{
    "id": "assignment-01",
    "label": "Assignment 1",
    "open": "2026-10-01T00:00:00-04:00",
    "deadline": {
        "at": "2026-10-31T23:59:00-04:00",
        "type": "hard",
        "extension": null
    },
    "submission": {
        "url": "https://example.edu/assignment/submit",
        "type": "individual",
        "groupSize": null
    },
    "aiPolicy": "restricted",
    "learningOutcomes": [
        "LO1",
        "LO2"
    ],
    "estimatedTime": "6–8 hours",
    "difficulty": "medium",
    "weight": 15,
    "bonus": true,
    "points": 100,
    "rubrics": {
        "ref": "attachments/rubric.json",
        "provided": true
    }
}
